{
  "schema_version": "2.4",
  "case_id": "V25-FINAL-STABLE",
  "binding": {
    "repository": "local/GitHub_PR_Review_Harness",
    "pr_number": null,
    "work_unit": "V25-FINAL",
    "base_sha": "37846aaade651c6540c2a9cc1a99c27684514a3b",
    "head_sha": "864ef63404f3b9997ce123a661afdf0a8056efc8"
  },
  "sensor": {
    "evidence_digest": "44f1e9d285173ac62109c2f32fc696319a21478a65ea5232bec63b87a298432b",
    "semantic_digest": "77946950d6950745cb6a95586f480b4994399a4f382e9842c5e22c873e13b4d3",
    "tool_version": "1.4.6-harness.1",
    "quality_class": "HEURISTIC",
    "score_ref": null
  },
  "review_trail": [
    {
      "review_id": "V25-FINAL-STABLE-L1",
      "parent_review_id": null,
      "level": "L1",
      "node_id": "L1-local",
      "model": {
        "family": "configured-local-reviewer",
        "version": "unconfigured"
      },
      "verdict": "PASS",
      "confidence": "high",
      "result_digest": "0a066ea082ee271c2475861c7a7f34b0430f1832f7fcc10b58c4407775704849",
      "reviewed_head_sha": "864ef63404f3b9997ce123a661afdf0a8056efc8",
      "evidence_digest": "44f1e9d285173ac62109c2f32fc696319a21478a65ea5232bec63b87a298432b",
      "input_digest": "bf49da75c25c5785b60c346df2eab42b3320666917a7935978e77d027a9a5df3",
      "prompt_digest": "ae9a577caeed234d245ce9537565a548106b28e542ea106ac6c084e621958de7",
      "skill_digest": "0000000000000000000000000000000000000000000000000000000000000000",
      "policy_digest": "37f9e5b7a3ebf94720746c48b2d0b9fa1980d69e285e4c9d12bd795c1cd3907c",
      "standards_digest": "4f53cda18c2baa0c0354bb5f9a3ecbe5ed12ab4d8e11ba873c2f11161202b945",
      "independent_context": false,
      "requested_level": "L1",
      "achieved_level": "L1",
      "timestamp": null,
      "finding_families": []
    },
    {
      "review_id": "V25-FINAL-STABLE-L2",
      "parent_review_id": null,
      "level": "L2",
      "node_id": "L2-local",
      "model": {
        "family": "configured-local-reviewer",
        "version": "unconfigured"
      },
      "verdict": "PASS",
      "confidence": "high",
      "result_digest": "c82bc071dc725b3d557b7d06823c71df851db3d17628c01f2cdf5c5b08f5f820",
      "reviewed_head_sha": "864ef63404f3b9997ce123a661afdf0a8056efc8",
      "evidence_digest": "44f1e9d285173ac62109c2f32fc696319a21478a65ea5232bec63b87a298432b",
      "input_digest": "8f3259f3b053b6f9fb20cbf18f044ad2881529eb66e86cf1cd405d806adc1c65",
      "prompt_digest": "ae9a577caeed234d245ce9537565a548106b28e542ea106ac6c084e621958de7",
      "skill_digest": "0000000000000000000000000000000000000000000000000000000000000000",
      "policy_digest": "37f9e5b7a3ebf94720746c48b2d0b9fa1980d69e285e4c9d12bd795c1cd3907c",
      "standards_digest": "4f53cda18c2baa0c0354bb5f9a3ecbe5ed12ab4d8e11ba873c2f11161202b945",
      "independent_context": true,
      "requested_level": "L2",
      "achieved_level": "L2",
      "timestamp": null,
      "finding_families": []
    },
    {
      "review_id": "V25-FINAL-STABLE-ADVERSARIAL",
      "parent_review_id": null,
      "level": "ADVERSARIAL",
      "node_id": "adversarial-external",
      "model": {
        "family": "configured-independent-reviewer",
        "version": "unconfigured"
      },
      "verdict": "PASS",
      "confidence": "high",
      "result_digest": "2449fdf6c4239db78d4bcb3dc17b5115a2ef1e28679201c929c77174e10b3ff5",
      "reviewed_head_sha": "864ef63404f3b9997ce123a661afdf0a8056efc8",
      "evidence_digest": "44f1e9d285173ac62109c2f32fc696319a21478a65ea5232bec63b87a298432b",
      "input_digest": "be54e907fc2fa3cda4327801dd52dda43a2b3007679e7105bb7b0eacca349914",
      "prompt_digest": "ae9a577caeed234d245ce9537565a548106b28e542ea106ac6c084e621958de7",
      "skill_digest": "0000000000000000000000000000000000000000000000000000000000000000",
      "policy_digest": "37f9e5b7a3ebf94720746c48b2d0b9fa1980d69e285e4c9d12bd795c1cd3907c",
      "standards_digest": "4f53cda18c2baa0c0354bb5f9a3ecbe5ed12ab4d8e11ba873c2f11161202b945",
      "independent_context": true,
      "requested_level": "ADVERSARIAL",
      "achieved_level": "ADVERSARIAL",
      "timestamp": null,
      "finding_families": []
    }
  ],
  "outcome": {
    "author_response": "no_response",
    "merged": false,
    "merge_sha": null,
    "post_merge_status": "unknown",
    "incident_ref": null
  },
  "failure_families": [],
  "labels": [
    "governance",
    "model_session_independence_unverified",
    "shadow_only"
  ],
  "privacy": {
    "raw_source_centralized": false,
    "sanitized_fixture_created": false
  }
}
