{
  "schema_version": "2.4",
  "case_id": "CASE-V24-EXAMPLE",
  "binding": {
    "repository": "owner/example",
    "pr_number": null,
    "work_unit": "WU-V24-EXAMPLE",
    "base_sha": "09cb4fbed2f69b7129ec44770ba9838208cef70e",
    "head_sha": "a89d41619cac11b8195f76b93b3598b99eca9edf"
  },
  "sensor": {
    "evidence_digest": "e770b94f4649f892d008c247abfe91ebf7c8b705c7d44963a558a6c571ca4b03",
    "semantic_digest": "2ab301ddcca33714d638e5f1f1d67256242a4554e0390bb8ca507ab3da971943",
    "tool_version": "1.4.6-harness.2",
    "quality_class": "DETERMINISTIC",
    "score_ref": null
  },
  "review_trail": [
    {
      "review_id": "CASE-V24-EXAMPLE-L1",
      "parent_review_id": null,
      "level": "L1",
      "node_id": "L1-local",
      "model": {
        "family": "configured-local-reviewer",
        "version": "unconfigured"
      },
      "verdict": "PASS",
      "confidence": "high",
      "result_digest": "228f6341346eaeaaae2393a8a5981bb7a8e4f775584ef04eb5b428b3c107b7c3",
      "reviewed_head_sha": "a89d41619cac11b8195f76b93b3598b99eca9edf",
      "evidence_digest": "e770b94f4649f892d008c247abfe91ebf7c8b705c7d44963a558a6c571ca4b03",
      "input_digest": "e4aae6bcbbea80d3fcc720deffa0596dad6837eabca8850f2da1ae09ffcef25c",
      "prompt_digest": "ae9a577caeed234d245ce9537565a548106b28e542ea106ac6c084e621958de7",
      "skill_digest": "0000000000000000000000000000000000000000000000000000000000000000",
      "policy_digest": "8f64c9f662b91bf03461316b30071ec3f2f215541b1f166b619e1252bf97d866",
      "standards_digest": "4f53cda18c2baa0c0354bb5f9a3ecbe5ed12ab4d8e11ba873c2f11161202b945",
      "independent_context": false,
      "requested_level": "L1",
      "achieved_level": "L1",
      "timestamp": null,
      "finding_families": []
    },
    {
      "review_id": "CASE-V24-EXAMPLE-L2",
      "parent_review_id": null,
      "level": "L2",
      "node_id": "L2-local",
      "model": {
        "family": "configured-local-reviewer",
        "version": "unconfigured"
      },
      "verdict": "FINDINGS",
      "confidence": "high",
      "result_digest": "e349f88c0daa143dbabaae4ddae423daa530765b3b7c23b1f5c02a99b63f9d77",
      "reviewed_head_sha": "a89d41619cac11b8195f76b93b3598b99eca9edf",
      "evidence_digest": "e770b94f4649f892d008c247abfe91ebf7c8b705c7d44963a558a6c571ca4b03",
      "input_digest": "ecf40895dc78fca2ee37e4fd24220fd683659e750b1945663051c5ff08874c44",
      "prompt_digest": "ae9a577caeed234d245ce9537565a548106b28e542ea106ac6c084e621958de7",
      "skill_digest": "0000000000000000000000000000000000000000000000000000000000000000",
      "policy_digest": "8f64c9f662b91bf03461316b30071ec3f2f215541b1f166b619e1252bf97d866",
      "standards_digest": "4f53cda18c2baa0c0354bb5f9a3ecbe5ed12ab4d8e11ba873c2f11161202b945",
      "independent_context": true,
      "requested_level": "L2",
      "achieved_level": "L2",
      "timestamp": null,
      "finding_families": [
        "MOCK-MAJOR"
      ]
    }
  ],
  "outcome": {
    "author_response": "no_response",
    "merged": false,
    "merge_sha": null,
    "post_merge_status": "unknown",
    "incident_ref": null
  },
  "failure_families": [
    "MOCK-MAJOR"
  ],
  "labels": [
    "model_session_independence_unverified",
    "shadow_only"
  ],
  "privacy": {
    "raw_source_centralized": false,
    "sanitized_fixture_created": false
  }
}
